Security Description,Security No.,Symbol,Exchange,Currency,Conv Rate,Holding,Market Value,SP LC,SP GBP,Holding GBP
ABSA GROUP LTD,BFX05H3,ABG,JSE,ZAC,1,43170,463321.32,24969.0,11.4807462,495623.81345400005
ABU DHABI ISLAMIC BANK PJSC COMMON STOCK AED 1,6001728,ADIB,ADX,AED,1,114708,481565.01,23.28,4.707216,539955.332928
ADES HOLDING CO COMMON STOCK SAR 1,BR56KM3,2382,TADAWUL,SAR,1,105992,366401.49,17.44,3.4269600000000002,363230.34432000003
ADNOC LOGISTICS & SERVICES COMMON STOCK AED 1.983,BRBN103,ADNOCLS,ADX,AED,1,411462,491398.93,5.69,1.150518,473394.437316
AL RAJHI BANK COMMON STOCK SAR 10,B12LZH9,1120,TADAWUL,SAR,1,52919,1021664.37,104.9,20.61285,1090811.4091500002
ALDAR PROPERTIES PJSC COMMON STOCK AED 1,B0LX3Y2,ALDAR,ADX,AED,1,278047,489091.88,9.21,1.862262,517796.362314
ALDREES PETROLEUM AND TRANSPORT SERVICES CO COMMON STOCK SAR 10,B128FF8,4200,TADAWUL,SAR,1,6921,175459.57,122.1,23.99265,166053.13065
ALKHORAYEF WATER & POWER TECHNOLOGIES CO COMMON STOCK SAR 10,BN33QN1,2081,TADAWUL,SAR,1,8582,227775.36,121.2,23.815800000000003,204387.19560000004
ALPHA BANK SA COMMON STOCK EUR 0.3,BTJZ707,APHBF,OTC,USD,1,105820,330785.82,4.2,3.1254720000000002,330737.44704
ANGLOGOLD ASHANTI PLC ZAR,BRXH266,AU,NYSE,USD,1,3669,232543.21,101.36,75.4280576,276745.5433344
ARAB NATIONAL BANK COMMON STOCK SAR 10,B12LZK2,1080,TADAWUL,SAR,1,30202,128470.4,22.04,4.33086,130800.63372000001
ARABIAN CENTRES CO COMMON STOCK SAR 10,BKBF694,4321,TADAWUL,SAR,1,67609,253013.77,19.41,3.8140650000000003,257865.12058500003
ATHENS INTERNATIONAL AIRPORT SA COMMON STOCK EUR 1,BPYS8N3,AIA,ATHEX,EUR,1,20939,196361.49,11.13,9.6855486,202805.7021354
BANCA TRANSILVANIA SA COMMON STOCK RON 1,5393307,0DP9,LSIN,RON,1,36498,188928.77,2.125,0.36254625,13232.2130325
BANK OF CYPRUS HOLDINGS PLC COMMON STOCK EUR 0.1,BN2BZT5,318,GETTEX,EUR,1,42976,297949.46,4.23,3.6810306,158195.9710656
BENEFIT SYSTEMS SA COMMON STOCK PLN 1,B4XY9X2,0Q3J,LSE,PLN,1,536,388500.27,3250.0,669.7925,359008.78
DISCOVERY LTD COMMON STOCK ZAR 0.1,6177878,DSY,JSE,ZAC,1,24432,249423.14,23081.0,10.6126438,259288.11332160002
DUBAI ISLAMIC BANK PJSC COMMON STOCK AED 1,6283452,DIB,DFM,AED,1,180593,338869.99,9.81,1.983582,358221.024126
ELM CO COMMON STOCK SAR 10,BNYDSH8,7203,TADAWUL,SAR,1,1219,180614.48,782.0,153.663,187315.19700000001
EMAAR DEVELOPMENT PJSC COMMON STOCK AED 1,BDG1977,EMAARDEV,DFM,AED,1,97455,298860.98,17.0,3.4374,334991.817
EMAAR PROPERTIES PJSC COMMON STOCK AED 1,B01RM25,EMAAR,DFM,AED,1,196579,555090.5,15.0,3.033,596224.107
EMIRATES INTEGRATED TELECOMMUNICATIONS CO PJSC COMMON STOCK AED 1,B13TMN7,DU,DFM,AED,1,115911,227822.36,10.4,2.10288,243746.92367999998
ETIHAD ETISALAT CO COMMON STOCK SAR 10,B12LR51,7020,TADAWUL,SAR,1,27826,363750.2,70.15,13.784475000000002,383566.8013500001
EUROBANK SA COMMON STOCK EUR 0.22,BW9DW63,EUROB,ATHEX,EUR,1,115936,346716.88,4.068,3.5400549599999995,410419.81184255995
FIRSTRAND LTD COMMON STOCK ZAR 1,6606996,FSR,JSE,ZAC,1,145007,588811.94,9232.0,4.2448736,615536.3861152
FIX PRICE GROUP LTD GDR,X84CF24,PRIVATE,PRIVATE,RUB,1,577525,4036.09,,,
GAZPROM NEFT PJSC COMMON STOCK RUB,X84D1F6,SIBN,RUS,RUB,1,1265335,45528.86,501.1,4.9117822,6215049.930037
GAZPROM PJSC ADR,X84C976,GAZP,RUS,RUB,1,5365084,23190.66,126.5,1.239953,6652452.001052001
GAZPROM PJSC COMMON STOCK RUB,X8C529A,GAZP,RUS,RUB,1,8860909,189720.49,126.5,1.239953,10987110.697277
GOLD FIELDS LTD COMMON STOCK ZAR 50,6280215,0QQ8,LSE,CHF,1,26569,865122.04,5.05,4.734375,125787.609375
GRUPA KETY SA COMMON STOCK PLN 2.5,5216385,0LV3,LSE,PLN,1,1210,228576.95,853.0,175.79477,212711.6717
HALYK SAVINGS BANK OF KAZAKHSTAN JSC GDR USD,B1KDG41,HSBK,LSIN,USD,1,25227,561725.32,28.8,21.431808,540660.220416
HARMONY GOLD MINING CO LTD COMMON STOCK ZAR 50,6410562,0J39,LSE,USD,1,27699,415842.7,22.7,16.892432,467903.473968
JPM USD LIQUIDITY LVNAV X (DIST.),7253766,GBPGBP,FX_IDC,GBP,1,1011.54,752.05,1.0,1.0,1011.54
JSE LTD,B12W5L6,JSE,JSE,ZAC,1,43588,279667.53,14649.0,6.7356102,293591.7773976
KASPI.KZ JSC - ADR (SPONSORED) LEVEL III,BJY21K1,KSPI,NASDAQ,USD,1,7097,412243.86,76.03,56.578484800000005,401537.50662560004
KGHM POLSKA MIEDZ SA COMMON STOCK PLN 10,5263251,0O8D,LSIN,PLN,1,10004,580910.6,112.85,23.257256499999997,232665.59402599998
KRKA DD NOVO MESTO COMMON STOCK EUR 1,5157235,0HLK,LSIN,EUR,1,2055,362459.34,64.8,56.390255999999994,115881.97608
KRUK SA COMMON STOCK PLN 1,B4PTLY0,0Q3Y,LSIN,PLN,1,3037,308992.83,256.0,52.75904,160229.20448
KUMBA IRON ORE LTD COMMON STOCK ZAR 0.01,B1G4262,KUMBF,OTC,USD,1,18739,293442.72,21.74,16.1780384,303160.2615776
LUKOIL PJSC COMMON STOCK RUB,X84D1F5,LKOH,RUS,RUB,1,262047,121490.17,5395.5,52.886691,13858798.716477
LUKOIL PJSC COMMON STOCK RUB 0.025 RUB,X84C974,LKOH,RUS,RUB,1,362649,175660.39,5395.5,52.886691,19179305.604459
MAGNIT PJSC COMMON STOCK RUB 0.01,X8C505A,MGNT,RUS,RUB,1,180877,50382.3,3249.5,31.851599,5761221.672323
MD MEDICAL GROUP INVESTMENTS PLC GDR USD,X8C6397,MDMG,RUS,RUB,1,432517,18329.04,1467.7,14.3863954,6222360.5792218
METLEN ENERGY & METALS PLC COMMON STOCK EUR 1,BTQGS77,MTLN,LSE,EUR,1,9516,366843.85,42.35,36.853817,350700.922572
MMC NORILSK NICKEL PJSC COMMON STOCK RUB 1,X84C977,GMKN,RUS,RUB,1,7119200,127755.73,161.14,1.5794942799999998,11244735.678175999
MONETA MONEY BANK AS COMMON STOCK CZK 20,BD3CQ16,0RGC,LSIN,CZK,1,23477,163166.56,82.45,2.9453613499999998,69148.24841395
NAC KAZATOMPROM JSC GDR USD,BGXQL36,KAP,LSIN,USD,1,11639,477657.18,74.1,55.142255999999996,641800.717584
NASPERS LTD COMMON STOCK ZAR 2,BV2FFX7,NPN,JSE,ZAC,1,14918,738916.1,102615.0,47.182377,703866.700086
NATIONAL BANK OF GREECE SA COMMON STOCK EUR 1,BG087C6,0RCR,LSIN,EUR,1,35102,398447.69,15.065,13.1098643,460182.4566586
NATIONAL BANK OF KUWAIT SAKP COMMON STOCK KWD 100,6889526,NBK,KSE,KWF,1,206580,505957.65,1000.0,2.401,495998.57999999996
NEDBANK GROUP LTD COMMON STOCK ZAR 100,6628008,NED,JSE,ZAC,1,41161,491734.75,27038.0,12.432072400000001,511716.5320564
NOVA LJUBLJANSKA BANKA DD GDR EUR,BGRPD22,55VX,LSE,EUR,1,14767,465474.16,28.25,24.583715,363027.71940500004
NOVATEK PJSC COMMON STOCK RUB 0.1,X84C970,NVTK,RUS,RUB,1,103572,11823.98,1242.6,12.1799652,1261503.3556944
NOVATEK PJSC COMMON STOCK RUB 0.1,X84C972,NVTK,RUS,RUB,1,1268490,151298.2,1242.6,12.1799652,15450164.056548
NOVOLIPETSK STEEL PJSC COMMON STOCK RUB,X84C97E,NLMK,RUS,RUB,1,3657350,64454.45,108.86,1.06704572,3902559.664042
OPTIMA BANK SA COMMON STOCK EUR 3.45,BL571C1,OPTIMA,ATHEX,EUR,1,57840,387364.44,8.33,7.2489326,419278.26158399996
PARKIN CO PJSC COMMON STOCK AED 0.02,BRRGQF6,PARKIN,DFM,AED,1,178126,204799.13,6.12,1.237464,220424.51246399997
PIRAEUS BANK SA COMMON STOCK EUR 0.93,BVLKBV3,TPEIR,ATHEX,EUR,1,55866,331412.75,8.368,7.28200096,406816.26563136
POLYUS PJSC COMMON STOCK RUB,X84D1F8,PLZL,RUS,RUB,1,297730,31129.25,2660.6,26.0792012,7764560.573276
POWSZECHNY ZAKLAD UBEZPIECZEN SA COMMON STOCK PLN 0.1,B63DG21,PZU,GPW,PLN,1,22525,310877.66,69.66,14.356229399999998,323374.06723499997
QATAR GAS TRANSPORT CO LTD COMMON STOCK QAR 1,B0MLBC9,QGTS,QSE,QAR,1,257026,235595.8,4.662,0.95188716,244659.74918615998
QATAR NATIONAL BANK QPSC COMMON STOCK QAR 1,6148197,QNBK,QSE,QAR,1,169179,644612.88,20.04,4.0917672,692241.0831287999
RIYAD BANK COMMON STOCK SAR 10,B12LZW4,1010,TADAWUL,SAR,1,54728,294413.07,27.3,5.364450000000001,293585.61960000003
RIYADH CABLES GROUP CO COMMON STOCK SAR 10,BNBPXW7,4142,TADAWUL,SAR,1,8636,222703.78,133.3,26.193450000000002,226206.63420000003
ROSNEFT OIL CO PJSC COMMON STOCK RUB,X84D1F9,ROSN,RUS,RUB,1,1677948,48575.17,399.4,3.9149187999999997,6569030.170622399
ROSNEFT OIL CO PJSC COMMON STOCK RUB 0.01,X84C971,ROSN,RUS,RUB,1,2041744,56504.75,399.4,3.9149187999999997,7993261.970387199
ROSTELECOM PJSC COMMON STOCK RUB,X84C978,RTKM,RUS,RUB,1,6156103,39273.28,64.3,0.6302686,3879998.4192657997
SANLAM LTD COMMON STOCK ZAR 1,B0L6750,SLM,JSE,ZAC,1,69192,305764.51,10148.0,4.6660504000000005,322853.3592768
SARANTIS SA EUR1.53,7124958,SAR,ATHEX,EUR,1,24341,289050.3,13.68,11.904609599999999,289770.10227359994
SASOL LTD COMMON STOCK ZAR 0,6777450,SOL,JSE,ZAC,1,77960,371270.1,10476.0,4.8168648,375522.779808
SAUDI AWWAL BANK COMMON STOCK SAR 10,B12LSY7,1060,TADAWUL,SAR,1,26440,169697.7,35.06,6.889290000000001,182152.82760000002
SAUDI GROUND SERVICES CO COMMON STOCK SAR 10,BYYTJ69,4031,TADAWUL,SAR,1,20014,143687.84,37.0,7.2705,145511.787
SBERBANK OF RUSSIA PJSC,X8C6398,SBER,RUS,RUB,1,2355925,27625.17,306.68,3.00607736,7082092.804358
SBERBANK OF RUSSIA PJSC PREFERENCE RUB 3,X8C6155,SBER,RUS,RUB,1,14455036,170731.16,306.68,3.00607736,43452956.45758496
SEVERSTAL PAO GDR USD,X84C975,CHMF,RUS,RUB,1,552780,246.99,971.2,9.5197024,5262301.092672
SHOPRITE HOLDINGS LTD COMMON STOCK ZAR 113.4,6801575,SHP,JSE,ZAC,1,33424,405257.48,27165.5,12.4906969,417489.0531856
SIBANYE STILLWATER LTD COMMON STOCK ZAR,BL0L913,SSW,JSE,ZAC,1,170486,460876.78,7104.5,3.2666491,556917.9384626
SISTEMA PJSFC COMMON STOCK RUB 0.09,X84D1F7,AFKS,RUS,RUB,1,12313057,13776.47,13.436,0.131699672,1621625.5682173038
STANDARD BANK GROUP LTD COMMON STOCK ZAR 10,B030GJ7,SBK,JSE,ZAC,1,50500,655192.1,29285.0,13.465243000000001,679994.7715
TATNEFT PJSC COMMON STOCK RUB,X84C973,TATN,RUS,RUB,1,730066,24622.77,569.5,5.582239,4075402.897774
TATNEFT PJSC PREFERENCE RUB 1,X8C6150,TATNP,RUS,RUB,1,571359,17065.03,539.8,5.291119599999999,3023128.8035363997
TCS GROUP HOLDING PLC GDR,X8C4FD3,TCSG,RUS,RUB,1,75226,1785.78,3342.6,32.7641652,2464717.0913352002
TECOM GROUP PJSC COMMON STOCK AED 0.1,BLDC8Q1,TECOM,DFM,AED,1,228871,157978.36,3.62,0.731964,167525.33264399998
THE SAUDI NATIONAL BANK,BSHYYN1,1180,TADAWUL,SAR,1,89266,670245.19,42.44,8.33946,744430.2363600001
TUPRAS-TURKIYE PETROL RAFINE,B03MYT9,TUPRS,BIST,TRY,1,56165,179218.79,223.9,3.757042,211014.26393000002
TURK HAVA YOLLARI AO COMMON STOCK TRY 1,B03MYK0,THYAO,BIST,TRY,1,31577,146714.16,299.5,5.02561,158693.68697
TURKIYE SIGORTA AS COMMON STOCK TRY 1,B03MTD8,RAYSG,BIST,TRY,1,737944,150682.31,220.4,3.698312,2729147.150528
UNITED ELECTRONICS CO COMMON STOCK SAR,B4P2SD7,4003,TADAWUL,SAR,1,14337,240133.45,87.3,17.15445,245943.34965000002
UNITED INTERNATIONAL TRANSPORTATION CO COMMON STOCK SAR 10,B2493D0,4260,TADAWUL,SAR,1,12911,159563.66,62.2,12.2223,157802.1153
VALTERRA PLATINUM LTD COMMON STOCK ZAR 10,6761000,VAL,JSE,ZAC,1,10460,661537.26,159219.0,73.2088962,765765.054252
VTB BANK PJSC COMMON STOCK RUB 0.01,X8C6392,VTBR,RUS,RUB,1,4246654,38202.68,72.86,0.71417372,3032848.68473288
WE BUY CARS HOLDINGS LTD COMMON STOCK ZAR,BSB8C80,WBC,JSE,ZAC,1,72103,154477.69,5342.0,2.4562516,177103.1091148
X 5 RETAIL GROUP NV-REGS GDR,X8C4FD9,X5,RUS,RUB,1,275182,1087.19,2581.5,25.303863,6963167.628066
