Security Description,Security No.,Symbol,Exchange,Currency,Conv Rate,Holding,Market Value,SP LC,SP GBP,Holding GBP
ABSA GROUP LTD,BFX05H3,ABG,JSE,ZAC,1,37303,431737.57,27174.0,12.630475200000001,471154.61638560006
ABU DHABI ISLAMIC BANK PJSC COMMON STOCK AED 1,6001728,ADIB,ADX,AED,1,62573,302200.21,25.5,5.143095000000001,321818.883435
ADES HOLDING CO COMMON STOCK SAR 1,BR56KM3,2382,TADAWUL,SAR,1,83169,310253.82,17.93,3.5124869999999997,292130.031303
ADNOC LOGISTICS & SERVICES COMMON STOCK AED 1.983,BRBN103,ADNOCLS,ADX,AED,1,411462,457198.69,5.48,1.1052612000000002,454772.9838744001
AL RAJHI BANK COMMON STOCK SAR 10,B12LZH9,1120,TADAWUL,SAR,1,52919,1102201.1,101.0,19.785899999999998,1047050.0420999998
ALDAR PROPERTIES PJSC COMMON STOCK AED 1,B0LX3Y2,ALDAR,ADX,AED,1,278047,528531.57,10.8,2.178252,605656.433844
ALDREES PETROLEUM AND TRANSPORT SERVICES CO COMMON STOCK SAR 10,B128FF8,4200,TADAWUL,SAR,1,6921,159615.11,117.0,22.920299999999997,158631.3963
ALKHORAYEF WATER & POWER TECHNOLOGIES CO COMMON STOCK SAR 10,BN33QN1,2081,TADAWUL,SAR,1,8582,206425.61,115.5,22.62645,194180.19389999998
ALPHA BANK SA COMMON STOCK EUR 0.3,BTJZ707,APHBF,OTC,USD,1,83221,292195.77,4.01,2.9765026999999997,247707.53119669997
ANGLOGOLD ASHANTI PLC ZAR,BRXH266,AU,NYSE,USD,1,3669,248066.91,126.07,93.57797889999999,343337.60458409996
ARAB NATIONAL BANK COMMON STOCK SAR 10,B12LZK2,1080,TADAWUL,SAR,1,30202,133790.41,20.6,4.03554,121881.37908
ARABIAN CENTRES CO COMMON STOCK SAR 10,BKBF694,4321,TADAWUL,SAR,1,84990,321835.61,18.08,3.5418719999999997,301023.70128
ATHENS INTERNATIONAL AIRPORT SA COMMON STOCK EUR 1,BPYS8N3,AIA,ATHEX,EUR,1,20939,205670.41,11.26,9.865674199999999,206577.3520738
BANCA TRANSILVANIA SA COMMON STOCK RON 1,5393307,0DP9,LSIN,RON,1,36498,201302.91,2.125,0.36492625,13319.0782725
BANK OF CYPRUS HOLDINGS PLC COMMON STOCK EUR 0.1,BN2BZT5,318,GETTEX,EUR,1,42976,347238.5,4.23,3.7061991000000005,159277.61252160004
BENEFIT SYSTEMS SA COMMON STOCK PLN 1,B4XY9X2,0Q3J,LSE,PLN,1,536,420824.76,3250.0,672.75,360594.0
DISCOVERY LTD COMMON STOCK ZAR 0.1,6177878,DSY,JSE,ZAC,1,24432,261089.55,26362.0,12.2530576,299366.7032832
DUBAI ISLAMIC BANK PJSC COMMON STOCK AED 1,6283452,DIB,DFM,AED,1,180593,346150.73,8.3,1.6740270000000002,302317.55801100004
ELECTRICAL INDUSTRIES CO COMMON STOCK SAR 0.5,BSMSY94,1303,TADAWUL,SAR,1,68742,182443.04,14.73,2.885607,198362.39639399998
ELM CO COMMON STOCK SAR 10,BNYDSH8,7203,TADAWUL,SAR,1,1219,183789.14,641.0,125.5719,153072.1461
EMAAR DEVELOPMENT PJSC COMMON STOCK AED 1,BDG1977,EMAARDEV,DFM,AED,1,97455,331631.26,19.35,3.9027015000000005,380337.77468250005
EMAAR PROPERTIES PJSC COMMON STOCK AED 1,B01RM25,EMAAR,DFM,AED,1,196579,585080.46,16.2,3.267378,642297.899862
EMIRATES INTEGRATED TELECOMMUNICATIONS CO PJSC COMMON STOCK AED 1,B13TMN7,DU,DFM,AED,1,115911,236891.29,10.95,2.2085055,255990.08101049997
ETIHAD ETISALAT CO COMMON STOCK SAR 10,B12LR51,7020,TADAWUL,SAR,1,27826,380067.32,64.3,12.596369999999999,350506.59161999996
EUROBANK SA COMMON STOCK EUR 0.22,BW9DW63,EUROB,ATHEX,EUR,1,93766,336129.69,3.943,3.45473831,323936.99237546005
FIRSTRAND LTD COMMON STOCK ZAR 1,6606996,FSR,JSE,ZAC,1,145007,609745.42,9934.0,4.6173232,669544.1852624001
FIX PRICE GROUP LTD GDR,X84CF24,PRIVATE,PRIVATE,RUB,1,577525,3956.09,,,
GAZPROM NEFT PJSC COMMON STOCK RUB,X84D1F6,SIBN,RUS,RUB,1,1265335,44626.42,506.5,4.8537894999999995,6141669.736982499
GAZPROM PJSC ADR,X84C976,GAZP,RUS,RUB,1,5365084,22730.99,127.13,1.2182867899999998,6536210.964440359
GAZPROM PJSC COMMON STOCK RUB,X8C529A,GAZP,RUS,RUB,1,8860909,185959.95,127.13,1.2182867899999998,10795128.382092109
GOLD FIELDS LTD COMMON STOCK ZAR 50,6280215,0QQ8,LSE,CHF,1,26569,1025831.49,5.05,4.85911,129101.69359000001
GRUPA KETY SA COMMON STOCK PLN 2.5,5216385,0LV3,LSE,PLN,1,1210,253581.66,853.0,176.571,213650.91
HALYK SAVINGS BANK OF KAZAKHSTAN JSC GDR USD,B1KDG41,HSBK,LSIN,USD,1,25227,591035.19,32.15,23.863980499999997,602016.6360734999
HARMONY GOLD MINING CO LTD COMMON STOCK ZAR 50,6410562,0J39,LSE,USD,1,27699,457784.79,22.34,16.5823118,459313.4545482
IMPALA PLATINUM HOLDINGS LTD COMMON STOCK ZAR 0,B1FFT76,0S2J,LSE,USD,1,28699,412082.27,21.69,16.0998363,462049.20197369996
JPM USD LIQUIDITY LVNAV X (DIST.),7253766,GBPGBP,FX_IDC,GBP,1,1011.54,737.14,1.0,1.0,1011.54
JSE LTD,B12W5L6,JSE,JSE,ZAC,1,43588,293861.79,16386.0,7.6162128000000004,331975.4835264
KASPI.KZ JSC - ADR (SPONSORED) LEVEL III,BJY21K1,KSPI,NASDAQ,USD,1,8223,455658.16,71.29,52.91642830000001,435131.78991090006
KGHM POLSKA MIEDZ SA COMMON STOCK PLN 10,5263251,0O8D,LSIN,PLN,1,10004,684420.93,305.8,63.300599999999996,633259.2024
KRKA DD NOVO MESTO COMMON STOCK EUR 1,5157235,0HLK,LSIN,EUR,1,2055,407974.74,64.8,56.775816,116674.30188
KRUK SA COMMON STOCK PLN 1,B4PTLY0,0Q3Y,LSIN,PLN,1,3037,305717.9,256.0,52.992,160936.704
KUMBA IRON ORE LTD COMMON STOCK ZAR 0.01,B1G4262,KUMBF,OTC,USD,1,18739,306534.24,21.74,16.1369498,302390.3023022
LUKOIL PJSC COMMON STOCK RUB,X84D1F5,LKOH,RUS,RUB,1,262047,119082.06,5187.0,49.707021,13025575.731987
LUKOIL PJSC COMMON STOCK RUB 0.025 RUB,X84C974,LKOH,RUS,RUB,1,362649,178907.36,5187.0,49.707021,18026201.458629
MAGNIT PJSC COMMON STOCK RUB 0.01,X8C505A,MGNT,RUS,RUB,1,180877,49383.65,3362.0,32.218046,5827503.506342
MD MEDICAL GROUP INVESTMENTS PLC GDR USD,X8C6397,MDMG,RUS,RUB,1,432517,17965.73,1468.8,14.075510399999999,6087897.531676799
METLEN ENERGY & METALS PLC COMMON STOCK EUR 1,BTQGS77,MTLN,LSE,EUR,1,9516,379488.16,36.6,32.067822,305157.394152
MMC NORILSK NICKEL PJSC COMMON STOCK RUB 1,X84C977,GMKN,RUS,RUB,1,7119200,125223.42,164.84,1.57966172,11245927.717024
MONETA MONEY BANK AS COMMON STOCK CZK 20,BD3CQ16,0RGC,LSIN,CZK,1,23477,172709.88,82.45,2.9766099,69881.8706223
NAC KAZATOMPROM JSC GDR USD,BGXQL36,KAP,LSIN,USD,1,9743,583621.49,83.1,61.68263699999999,600973.9322909999
NASPERS LTD COMMON STOCK ZAR 2,BV2FFX7,NPN,JSE,ZAC,1,16183,729091.17,89508.0,41.6033184,673266.5016672
NATIONAL BANK OF GREECE SA COMMON STOCK EUR 1,BG087C6,0RCR,LSIN,EUR,1,31425,406199.04,14.03,12.292665099999999,386297.00076749997
NATIONAL BANK OF KUWAIT SAKP COMMON STOCK KWD 100,6889526,NBK,KSE,KWF,1,206580,466486.05,943.0,2.264143,467726.66094
NEDBANK GROUP LTD COMMON STOCK ZAR 100,6628008,NED,JSE,ZAC,1,35976,433756.19,31323.0,14.558930400000001,523772.0800704
NORTHAM PLATINUM HOLDINGS LTD COMMON STOCK ZAR,BMZ1NS0,NPH,JSE,ZAC,1,15071,271562.7,43759.0,20.3391832,306531.8300072
NOVA LJUBLJANSKA BANKA DD GDR EUR,BGRPD22,55VX,LSE,EUR,1,14767,469833.85,28.25,24.7518025,365509.8675175
NOVATEK PJSC COMMON STOCK RUB 0.1,X84C972,NVTK,RUS,RUB,1,1268490,154094.85,1195.5,11.456476499999999,14532425.875485
NOVATEK PJSC COMMON STOCK RUB 0.1,X84C970,NVTK,RUS,RUB,1,103572,11589.61,1195.5,11.456476499999999,1186570.1840579999
NOVOLIPETSK STEEL PJSC COMMON STOCK RUB,X84C97E,NLMK,RUS,RUB,1,3657350,65645.85,112.54,1.07847082,3944345.2535269996
OPTIMA BANK SA COMMON STOCK EUR 3.45,BL571C1,OPTIMA,ATHEX,EUR,1,57840,432738.01,9.9,8.674083,501708.96072
PARKIN CO PJSC COMMON STOCK AED 0.02,BRRGQF6,PARKIN,DFM,AED,1,178126,218071.89,5.89,1.1879541,211605.5120166
PIRAEUS BANK SA COMMON STOCK EUR 0.93,BVLKBV3,TPEIR,ATHEX,EUR,1,41300,304695.18,8.114,7.109243380000001,293611.75159400003
POLYUS PJSC COMMON STOCK RUB,X84D1F8,PLZL,RUS,RUB,1,297730,31704.65,2487.4,23.836754199999998,7096916.827965999
POWSZECHNY ZAKLAD UBEZPIECZEN SA COMMON STOCK PLN 0.1,B63DG21,PZU,GPW,PLN,1,22525,325289.77,67.32,13.935239999999999,313891.28099999996
QATAR GAS TRANSPORT CO LTD COMMON STOCK QAR 1,B0MLBC9,QGTS,QSE,QAR,1,257026,246924.61,4.93,1.0030085,257799.262721
QATAR NATIONAL BANK QPSC COMMON STOCK QAR 1,6148197,QNBK,QSE,QAR,1,185253,734135.99,19.3,3.9265849999999998,727411.651005
RIYAD BANK COMMON STOCK SAR 10,B12LZW4,1010,TADAWUL,SAR,1,54728,298580.27,27.78,5.442102,297835.35825600004
RIYADH CABLES GROUP CO COMMON STOCK SAR 10,BNBPXW7,4142,TADAWUL,SAR,1,8636,219302.03,117.8,23.077019999999997,199293.14471999998
ROSNEFT OIL CO PJSC COMMON STOCK RUB,X84D1F9,ROSN,RUS,RUB,1,1677948,49473.05,393.65,3.7723479499999995,6329803.698006599
ROSNEFT OIL CO PJSC COMMON STOCK RUB 0.01,X84C971,ROSN,RUS,RUB,1,2041744,55384.75,393.65,3.7723479499999995,7702168.792824799
ROSTELECOM PJSC COMMON STOCK RUB,X84C978,RTKM,RUS,RUB,1,6156103,38494.83,64.87,0.6216492100000001,3826936.5666286303
SANLAM LTD COMMON STOCK ZAR 1,B0L6750,SLM,JSE,ZAC,1,69192,317546.51,10629.0,4.9403592000000005,341833.33376640006
SARANTIS SA EUR1.53,7124958,SAR,ATHEX,EUR,1,24341,286143.62,14.54,12.739511799999999,310092.4567238
SASOL LTD COMMON STOCK ZAR 0,6777450,SOL,JSE,ZAC,1,90498,469196.44,14300.0,6.6466400000000005,601507.6267200001
SAUDI AWWAL BANK COMMON STOCK SAR 10,B12LSY7,1060,TADAWUL,SAR,1,26440,183290.82,34.22,6.703697999999999,177245.77511999998
SAUDI GROUND SERVICES CO COMMON STOCK SAR 10,BYYTJ69,4031,TADAWUL,SAR,1,20014,143798.79,32.4,6.34716,127032.06023999999
SBERBANK OF RUSSIA PJSC,X8C6398,SBER,RUS,RUB,1,2355925,27077.59,314.86,3.01730338,7108540.4655265
SBERBANK OF RUSSIA PJSC PREFERENCE RUB 3,X8C6155,SBER,RUS,RUB,1,14455036,167347.02,314.86,3.01730338,43615228.98082168
SEVERSTAL PAO GDR USD,X84C975,CHMF,RUS,RUB,1,552780,242.1,966.8,9.2648444,5121420.6874319995
SHOPRITE HOLDINGS LTD COMMON STOCK ZAR 113.4,6801575,SHP,JSE,ZAC,1,33424,404627.44,26385.0,12.263748000000001,409903.513152
SIBANYE STILLWATER LTD COMMON STOCK ZAR,BL0L913,SSW,JSE,ZAC,1,141197,473362.89,7036.0,3.2703328000000003,461761.1803616
SISTEMA PJSFC COMMON STOCK RUB 0.09,X84D1F7,AFKS,RUS,RUB,1,12313057,13503.4,13.894,0.133146202,1639436.774559514
STANDARD BANK GROUP LTD COMMON STOCK ZAR 10,B030GJ7,SBK,JSE,ZAC,1,45628,619356.01,32350.0,15.036280000000001,686075.38384
TATNEFT PJSC COMMON STOCK RUB,X84C973,TATN,RUS,RUB,1,730066,24134.71,544.3,5.216026899999999,3808043.8947753995
TATNEFT PJSC PREFERENCE RUB 1,X8C6150,TATNP,RUS,RUB,1,571359,16726.78,518.8,4.971660399999999,2840602.9144836
TCS GROUP HOLDING PLC GDR,X8C4FD3,TCSG,RUS,RUB,1,75226,1750.39,3464.6,33.2012618,2497598.1201668
TECOM GROUP PJSC COMMON STOCK AED 0.1,BLDC8Q1,TECOM,DFM,AED,1,228871,170752.01,3.75,0.7563375,173103.7199625
THE SAUDI NATIONAL BANK,BSHYYN1,1180,TADAWUL,SAR,1,97150,846752.53,41.68,8.165111999999999,793240.6307999999
TIGER BRANDS LTD COMMON STOCK ZAR 10,B0J4PP2,TBS,JSE,ZAC,1,11872,182000.8,31003.0,14.4101944,171077.8279168
TURKIYE SIGORTA AS COMMON STOCK TRY 1,B03MTD8,RAYSG,BIST,TRY,1,737944,150723.33,222.3,3.6657270000000004,2705101.2452880004
UNITED ELECTRONICS CO COMMON STOCK SAR,B4P2SD7,4003,TADAWUL,SAR,1,14337,244711.56,82.85,16.230314999999997,232694.02615499997
UNITED INTERNATIONAL TRANSPORTATION CO COMMON STOCK SAR 10,B2493D0,4260,TADAWUL,SAR,1,6420,75464.87,40.52,7.937868,50961.11256
VALTERRA PLATINUM LTD COMMON STOCK ZAR 10,6761000,VAL,JSE,ZAC,1,7775,536985.6,186055.0,86.478364,672369.2801
VTB BANK PJSC COMMON STOCK RUB 0.01,X8C6392,VTBR,RUS,RUB,1,4246654,37445.44,87.22,0.8358292599999999,3549477.6702960394
WE BUY CARS HOLDINGS LTD COMMON STOCK ZAR,BSB8C80,WBC,JSE,ZAC,1,72103,150447.61,4355.0,2.024204,145951.18101200002
X 5 RETAIL GROUP NV-REGS GDR,X8C4FD9,X5,RUS,RUB,1,275182,1065.64,2427.0,23.257941,6400166.720261999
