Security Description,Security No.,Symbol,Exchange,Currency,Conv Rate,Holding,Market Value,SP LC,SP GBP,Holding GBP
ABSA GROUP LTD,BFX05H3,ABG,JSE,ZAC,1,37303,431737.57,25417.0,11.6536945,434717.7659335
ABU DHABI ISLAMIC BANK PJSC COMMON STOCK AED 1,6001728,ADIB,ADX,AED,1,62573,302200.21,25.5,5.22036,326653.58628000005
ADES HOLDING CO COMMON STOCK SAR 1,BR56KM3,2382,TADAWUL,SAR,1,83169,310253.82,15.75,3.1311,260410.4559
ADNOC LOGISTICS & SERVICES COMMON STOCK AED 1.983,BRBN103,ADNOCLS,ADX,AED,1,411462,457198.69,5.48,1.1218656000000002,461605.0635072001
AL RAJHI BANK COMMON STOCK SAR 10,B12LZH9,1120,TADAWUL,SAR,1,52919,1102201.1,97.25,19.3333,1023098.9027000001
ALDAR PROPERTIES PJSC COMMON STOCK AED 1,B0LX3Y2,ALDAR,ADX,AED,1,278047,528531.57,10.8,2.2109760000000005,614755.2438720001
ALDREES PETROLEUM AND TRANSPORT SERVICES CO COMMON STOCK SAR 10,B128FF8,4200,TADAWUL,SAR,1,6921,159615.11,112.1,22.28548,154237.80708
ALKHORAYEF WATER & POWER TECHNOLOGIES CO COMMON STOCK SAR 10,BN33QN1,2081,TADAWUL,SAR,1,8582,206425.61,111.9,22.245720000000002,190912.76904
ALPHA BANK SA COMMON STOCK EUR 0.3,BTJZ707,APHBF,OTC,USD,1,83221,292195.77,4.01,3.0216553,251465.17572129998
ANGLOGOLD ASHANTI PLC ZAR,BRXH266,AU,NYSE,USD,1,3669,248066.91,128.26,96.6477578,354600.6233682
ARAB NATIONAL BANK COMMON STOCK SAR 10,B12LZK2,1080,TADAWUL,SAR,1,30202,133790.41,19.93,3.962084,119662.860968
ARABIAN CENTRES CO COMMON STOCK SAR 10,BKBF694,4321,TADAWUL,SAR,1,84990,321835.61,16.0,3.1808,270336.192
ATHENS INTERNATIONAL AIRPORT SA COMMON STOCK EUR 1,BPYS8N3,AIA,ATHEX,EUR,1,20939,205670.41,10.31,8.9977432,188403.7448648
BANCA TRANSILVANIA SA COMMON STOCK RON 1,5393307,0DP9,LSIN,RON,1,36498,201302.91,2.125,0.363375,13262.46075
BANK OF CYPRUS HOLDINGS PLC COMMON STOCK EUR 0.1,BN2BZT5,318,GETTEX,EUR,1,42976,347238.5,4.23,3.6916056000000004,158650.44226560002
BENEFIT SYSTEMS SA COMMON STOCK PLN 1,B4XY9X2,0Q3J,LSE,PLN,1,536,420824.76,3250.0,659.5875,353538.89999999997
DISCOVERY LTD COMMON STOCK ZAR 0.1,6177878,DSY,JSE,ZAC,1,24432,261089.55,25861.0,11.8572685,289696.783992
DUBAI ISLAMIC BANK PJSC COMMON STOCK AED 1,6283452,DIB,DFM,AED,1,180593,346150.73,8.3,1.6991760000000002,306859.29136800003
ELECTRICAL INDUSTRIES CO COMMON STOCK SAR 0.5,BSMSY94,1303,TADAWUL,SAR,1,68742,182443.04,14.94,2.970072,204168.689424
ELM CO COMMON STOCK SAR 10,BNYDSH8,7203,TADAWUL,SAR,1,1219,183789.14,529.0,105.1652,128196.37879999999
EMAAR DEVELOPMENT PJSC COMMON STOCK AED 1,BDG1977,EMAARDEV,DFM,AED,1,97455,331631.26,19.35,3.9613320000000005,386051.61006000004
EMAAR PROPERTIES PJSC COMMON STOCK AED 1,B01RM25,EMAAR,DFM,AED,1,196579,585080.46,16.2,3.316464,651947.176656
EMIRATES INTEGRATED TELECOMMUNICATIONS CO PJSC COMMON STOCK AED 1,B13TMN7,DU,DFM,AED,1,115911,236891.29,10.95,2.241684,259835.834124
ETIHAD ETISALAT CO COMMON STOCK SAR 10,B12LR51,7020,TADAWUL,SAR,1,27826,380067.32,62.9,12.50452,347950.77352
EUROBANK SA COMMON STOCK EUR 0.22,BW9DW63,EUROB,ATHEX,EUR,1,93766,336129.69,3.46,3.0196112,283136.8637792
FIRSTRAND LTD COMMON STOCK ZAR 1,6606996,FSR,JSE,ZAC,1,145007,609745.42,9287.0,4.2580895000000005,617452.7841265001
FIX PRICE GROUP LTD GDR,X84CF24,PRIVATE,PRIVATE,RUB,1,577525,3956.09,,,
GAZPROM NEFT PJSC COMMON STOCK RUB,X84D1F6,SIBN,RUS,RUB,1,1265335,44626.42,533.65,5.16626565,6537056.7462427495
GAZPROM PJSC ADR,X84C976,GAZP,RUS,RUB,1,5365084,22730.99,130.8,1.2662748000000001,6793670.6690832
GAZPROM PJSC COMMON STOCK RUB,X8C529A,GAZP,RUS,RUB,1,8860909,185959.95,130.8,1.2662748000000001,11220345.771793202
GOLD FIELDS LTD COMMON STOCK ZAR 50,6280215,0QQ8,LSE,CHF,1,26569,1025831.49,5.05,4.830325,128336.90492500001
GRUPA KETY SA COMMON STOCK PLN 2.5,5216385,0LV3,LSE,PLN,1,1210,253581.66,853.0,173.11634999999998,209470.7835
HALYK SAVINGS BANK OF KAZAKHSTAN JSC GDR USD,B1KDG41,HSBK,LSIN,USD,1,25227,591035.19,31.25,23.547812500000003,594040.6659375001
HARMONY GOLD MINING CO LTD COMMON STOCK ZAR 50,6410562,0J39,LSE,USD,1,27699,457784.79,21.26,16.0200478,443739.30401220004
IMPALA PLATINUM HOLDINGS LTD COMMON STOCK ZAR 0,B1FFT76,0S2J,LSE,USD,1,28699,412082.27,21.36,16.0954008,461921.9075592
JPM USD LIQUIDITY LVNAV X (DIST.),7253766,GBPGBP,FX_IDC,GBP,1,1011.54,737.14,1.0,1.0,1011.54
JSE LTD,B12W5L6,JSE,JSE,ZAC,1,43588,293861.79,17250.0,7.909125,344742.9405
KASPI.KZ JSC - ADR (SPONSORED) LEVEL III,BJY21K1,KSPI,NASDAQ,USD,1,8223,455658.16,78.0,58.77534,483309.62082
KGHM POLSKA MIEDZ SA COMMON STOCK PLN 10,5263251,0O8D,LSIN,PLN,1,10004,684420.93,305.8,62.06211,620869.34844
KRKA DD NOVO MESTO COMMON STOCK EUR 1,5157235,0HLK,LSIN,EUR,1,2055,407974.74,64.8,56.552256,116214.88608
KRUK SA COMMON STOCK PLN 1,B4PTLY0,0Q3Y,LSIN,PLN,1,3037,305717.9,256.0,51.9552,157787.9424
KUMBA IRON ORE LTD COMMON STOCK ZAR 0.01,B1G4262,KUMBF,OTC,USD,1,18739,306534.24,21.74,16.381742199999998,306977.46708579996
LUKOIL PJSC COMMON STOCK RUB,X84D1F5,LKOH,RUS,RUB,1,262047,119082.06,5572.0,53.942532,14135478.683004
LUKOIL PJSC COMMON STOCK RUB 0.025 RUB,X84C974,LKOH,RUS,RUB,1,362649,178907.36,5572.0,53.942532,19562205.287268
MAGNIT PJSC COMMON STOCK RUB 0.01,X8C505A,MGNT,RUS,RUB,1,180877,49383.65,3326.0,32.199006000000004,5824059.608262001
MD MEDICAL GROUP INVESTMENTS PLC GDR USD,X8C6397,MDMG,RUS,RUB,1,432517,17965.73,1434.2,13.8844902,6005278.0478334
METLEN ENERGY & METALS PLC COMMON STOCK EUR 1,BTQGS77,MTLN,LSE,EUR,1,9516,379488.16,33.55,29.279756,278626.15809599997
MMC NORILSK NICKEL PJSC COMMON STOCK RUB 1,X84C977,GMKN,RUS,RUB,1,7119200,125223.42,157.5,1.5247575,10855053.594
MONETA MONEY BANK AS COMMON STOCK CZK 20,BD3CQ16,0RGC,LSIN,CZK,1,23477,172709.88,82.45,2.95080305,69276.00320485
NAC KAZATOMPROM JSC GDR USD,BGXQL36,KAP,LSIN,USD,1,9743,583621.49,80.3,60.508459,589533.916037
NASPERS LTD COMMON STOCK ZAR 2,BV2FFX7,NPN,JSE,ZAC,1,16183,729091.17,84366.0,38.681811,625987.7474130001
NATIONAL BANK OF GREECE SA COMMON STOCK EUR 1,BG087C6,0RCR,LSIN,EUR,1,31425,406199.04,12.23,10.6733656,335410.51398
NATIONAL BANK OF KUWAIT SAKP COMMON STOCK KWD 100,6889526,NBK,KSE,KWF,1,206580,466486.05,929.0,2.256541,466156.23978
NEDBANK GROUP LTD COMMON STOCK ZAR 100,6628008,NED,JSE,ZAC,1,35976,433756.19,29867.0,13.694019500000001,492656.0455320001
NORTHAM PLATINUM HOLDINGS LTD COMMON STOCK ZAR,BMZ1NS0,NPH,JSE,ZAC,1,15071,271562.7,39248.0,17.995208,271205.779768
NOVA LJUBLJANSKA BANKA DD GDR EUR,BGRPD22,55VX,LSE,EUR,1,14767,469833.85,28.25,24.65434,364070.63878000004
NOVATEK PJSC COMMON STOCK RUB 0.1,X84C972,NVTK,RUS,RUB,1,1268490,154094.85,1292.5,12.5126925,15872225.309325
NOVATEK PJSC COMMON STOCK RUB 0.1,X84C970,NVTK,RUS,RUB,1,103572,11589.61,1292.5,12.5126925,1295964.58761
NOVOLIPETSK STEEL PJSC COMMON STOCK RUB,X84C97E,NLMK,RUS,RUB,1,3657350,65645.85,111.6,1.0803996,3951399.47706
OPTIMA BANK SA COMMON STOCK EUR 3.45,BL571C1,OPTIMA,ATHEX,EUR,1,57840,432738.01,8.6,7.5053920000000005,434111.87328000006
PARKIN CO PJSC COMMON STOCK AED 0.02,BRRGQF6,PARKIN,DFM,AED,1,178126,218071.89,5.89,1.2058008,214784.4733008
PIRAEUS BANK SA COMMON STOCK EUR 0.93,BVLKBV3,TPEIR,ATHEX,EUR,1,41300,304695.18,7.134,6.225984480000001,257133.15902400005
POLYUS PJSC COMMON STOCK RUB,X84D1F8,PLZL,RUS,RUB,1,297730,31704.65,2459.0,23.805579,7087635.03567
POWSZECHNY ZAKLAD UBEZPIECZEN SA COMMON STOCK PLN 0.1,B63DG21,PZU,GPW,PLN,1,22525,325289.77,64.08,13.005035999999999,292938.4359
QATAR GAS TRANSPORT CO LTD COMMON STOCK QAR 1,B0MLBC9,QGTS,QSE,QAR,1,257026,246924.61,4.52,0.9330635999999999,239821.60485359997
QATAR NATIONAL BANK QPSC COMMON STOCK QAR 1,6148197,QNBK,QSE,QAR,1,185253,734135.99,18.02,3.7198686,689116.8177558
RIYAD BANK COMMON STOCK SAR 10,B12LZW4,1010,TADAWUL,SAR,1,54728,298580.27,26.66,5.300008,290058.837824
RIYADH CABLES GROUP CO COMMON STOCK SAR 10,BNBPXW7,4142,TADAWUL,SAR,1,8636,219302.03,112.4,22.34512,192972.45632000003
ROSNEFT OIL CO PJSC COMMON STOCK RUB,X84D1F9,ROSN,RUS,RUB,1,1677948,49473.05,451.1,4.367099100000001,7327765.200646801
ROSNEFT OIL CO PJSC COMMON STOCK RUB 0.01,X84C971,ROSN,RUS,RUB,1,2041744,55384.75,451.1,4.367099100000001,8916498.384830402
ROSTELECOM PJSC COMMON STOCK RUB,X84C978,RTKM,RUS,RUB,1,6156103,38494.83,62.95,0.60941895,3751645.8263518503
SANLAM LTD COMMON STOCK ZAR 1,B0L6750,SLM,JSE,ZAC,1,69192,317546.51,9986.0,4.578581000000001,316801.17655200005
SARANTIS SA EUR1.53,7124958,SAR,ATHEX,EUR,1,24341,286143.62,13.88,12.113353600000002,294851.1399776
SASOL LTD COMMON STOCK ZAR 0,6777450,SOL,JSE,ZAC,1,90498,469196.44,15328.0,7.027888000000001,636009.808224
SAUDI AWWAL BANK COMMON STOCK SAR 10,B12LSY7,1060,TADAWUL,SAR,1,26440,183290.82,33.5,6.6598,176085.112
SAUDI GROUND SERVICES CO COMMON STOCK SAR 10,BYYTJ69,4031,TADAWUL,SAR,1,20014,143798.79,30.2,6.00376,120159.25263999999
SBERBANK OF RUSSIA PJSC,X8C6398,SBER,RUS,RUB,1,2355925,27077.59,312.5,3.0253125,7127409.3515625
SBERBANK OF RUSSIA PJSC PREFERENCE RUB 3,X8C6155,SBER,RUS,RUB,1,14455036,167347.02,312.5,3.0253125,43731001.09875
SEVERSTAL PAO GDR USD,X84C975,CHMF,RUS,RUB,1,552780,242.1,949.8,9.1950138,5082819.728364
SHOPRITE HOLDINGS LTD COMMON STOCK ZAR 113.4,6801575,SHP,JSE,ZAC,1,33424,404627.44,26140.0,11.985190000000001,400592.99056000006
SIBANYE STILLWATER LTD COMMON STOCK ZAR,BL0L913,SSW,JSE,ZAC,1,141197,473362.89,6095.0,2.7945575000000002,394583.13532750006
SISTEMA PJSFC COMMON STOCK RUB 0.09,X84D1F7,AFKS,RUS,RUB,1,12313057,13503.4,13.4,0.12972540000000002,1597316.2445478002
STANDARD BANK GROUP LTD COMMON STOCK ZAR 10,B030GJ7,SBK,JSE,ZAC,1,45628,619356.01,31102.0,14.260267,650667.4626760001
TATNEFT PJSC COMMON STOCK RUB,X84C973,TATN,RUS,RUB,1,730066,24134.71,631.0,6.1087110000000004,4459762.204926
TATNEFT PJSC PREFERENCE RUB 1,X8C6150,TATNP,RUS,RUB,1,571359,16726.78,599.9,5.8076319,3318242.7547521
TCS GROUP HOLDING PLC GDR,X8C4FD3,TCSG,RUS,RUB,1,75226,1750.39,3391.2,32.8302072,2469685.1668272
TECOM GROUP PJSC COMMON STOCK AED 0.1,BLDC8Q1,TECOM,DFM,AED,1,228871,170752.01,3.75,0.7677,175704.2667
THE SAUDI NATIONAL BANK,BSHYYN1,1180,TADAWUL,SAR,1,97150,846752.53,40.0,7.952,772536.8
TIGER BRANDS LTD COMMON STOCK ZAR 10,B0J4PP2,TBS,JSE,ZAC,1,11872,182000.8,31037.0,14.230464500000002,168944.07454400003
TURKIYE SIGORTA AS COMMON STOCK TRY 1,B03MTD8,RAYSG,BIST,TRY,1,737944,150723.33,202.3,3.384479,2497555.971176
UNITED ELECTRONICS CO COMMON STOCK SAR,B4P2SD7,4003,TADAWUL,SAR,1,14337,244711.56,80.0,15.904,228015.648
UNITED INTERNATIONAL TRANSPORTATION CO COMMON STOCK SAR 10,B2493D0,4260,TADAWUL,SAR,1,6420,75464.87,40.32,8.015616,51460.25472
VALTERRA PLATINUM LTD COMMON STOCK ZAR 10,6761000,VAL,JSE,ZAC,1,7775,536985.6,165795.0,76.0170075,591032.2333125001
VTB BANK PJSC COMMON STOCK RUB 0.01,X8C6392,VTBR,RUS,RUB,1,4246654,37445.44,85.485,0.827580285,3514447.12761639
WE BUY CARS HOLDINGS LTD COMMON STOCK ZAR,BSB8C80,WBC,JSE,ZAC,1,72103,150447.61,4241.0,1.9444985000000001,140204.1753455
X 5 RETAIL GROUP NV-REGS GDR,X8C4FD9,X5,RUS,RUB,1,275182,1065.64,2407.0,23.302167,6412336.919394
